<?xml version="1.0" encoding="UTF-8"?>
<tables xmlns="http://www.migrate.org/schema/tableschema"  xmlns:xsi="http://www.w3.org/2001/XMLSchema-instance" 
	 xsi:schemaLocation="http://www.migrate.org/schema/tableschema tables.xsd" >
    <!-- 专利申请数据的更新 -->
   <table type="MIGRATE" to="cs_rights_copyright" from="copyright_upload_model" note="软件著作权补助数据迁移-影视-补充" skip="false">
    	<fields>
    		<!-- target field list -->
    		<field name="rid" applyType="TARGET" valueType="FIELD" value="id"></field>
    		<field name="registNo" applyType="TARGET" valueType="FIELD" value="work_no" note="登记号"></field>
    		<field name="copyrightName" applyType="TARGET" valueType="FIELD" value="work_name"/>
    		<field name="copyrightType" applyType="TARGET" valueType="FIELD" value="type"/>
    		<field name="applyName" applyType="TARGET" valueType="FIELD" value="applicant_name"/>
    		<field name="applyContacts" applyType="TARGET" valueType="FIELD" value="apply_contacts"/>
    		<field name="issueDate" applyType="TARGET" valueType="FIELD" value="create_date"/>
    		<field name="creatorName" applyType="TARGET" valueType="FIELD" value="author_name"/>
    		<field name="registFee" applyType="TARGET" valueType="FIELD" value="regist_fee"/>
    		<field name="remark" applyType="TARGET" valueType="FIELD" value="paper_no"/>
    		
    		<field name="supportStatus" applyType="TARGET" valueType="FIXED" value="0"/>
    		<field name="result" applyType="TARGET" valueType="FIXED" value="1"/>
    		<field name="status" applyType="TARGET" valueType="FIXED" value="1"/>
    		<field name="odata" applyType="TARGET" valueType="FIXED" value="1"/>
    		
    		<field name="id" applyType="SOURCE"/>
    		<field name="work_no" applyType="SOURCE"/>
    		<field name="work_name" applyType="SOURCE" forLog="true" note="著作权名称"/>
    		<field name="type" applyType="SOURCE"/>
    		<field name="applicant_name" applyType="SOURCE"/>
    		<field name="apply_contacts" applyType="SOURCE"/>
    		<field name="author_name" applyType="SOURCE"/>
    		<field name="create_date" applyType="SOURCE"/>
    		<field name="regist_fee" applyType="SOURCE"/>
    		<field name="paper_no" applyType="SOURCE"/>
    	</fields>
    	<where>
    		<condition type="IN" applyType="SOURCE">
    			<field name="type" applyType="SOURCE" valueType="FIXED" value="类似摄制电影方法创作,类似摄制电影方法,录像,电影,录音,类似摄制电影方法创作的作品,录音制品,录像制品"></field>
    		</condition>
    	</where>
    	<formats>
    		<format clazz="com.ipph.migratecore.deal.format.JsonMethodFormater" fieldName="type" >{'类似摄制电影方法创作':'录像制品','类似摄制电影方法':'录像制品','录像':'录像制品','电影':'录像制品','录音':'录音制品','类似摄制电影方法创作的作品':'录像制品','录音制品':'录音制品','录像制品':'录像制品'}</format>
    	</formats>
    	<constraints>
    		<constraint type="PRIMARY" applyType="SOURCE">
    			<field name="id" applyType="SOURCE"/>
    		</constraint>
    		<constraint type="PRIMARY" applyType="TARGET">
    			<field name="rid" applyType="TARGET"/>
    		</constraint>
    	</constraints>
    </table>
</tables>