<?xml version="1.0" encoding="UTF-8"?>
<tables xmlns="http://www.migrate.org/schema/tableschema"  xmlns:xsi="http://www.w3.org/2001/XMLSchema-instance" 
	 xsi:schemaLocation="http://www.migrate.org/schema/tableschema tables.xsd" >
    <!-- 专利申请数据的更新 -->
   <table type="MIGRATE" to="wf_patent_support_foreign" from="patent_upload_model" note="专利PCT申请补录数据迁移" skip="false">
    	<fields>
    		<field name="id" applyType="TARGET" valueType="FIELD" value="id" note="主键字段"></field>
    		<field name="id" applyType="SOURCE"/>
    		<field name="patentName" applyType="TARGET" valueType="FIELD" value="patentName"/>
    		<field name="patentName" applyType="SOURCE"/>
    		<field name="applyNo" applyType="TARGET" valueType="FIELD" value="patentNo"/>
    		<field name="patentNo" applyType="SOURCE" note="申请号" forLog="true"></field>
    		<field name="applyDate" applyType="TARGET" valueType="FIELD" value="requestDate"/>
    		<field name="requestDate" applyType="SOURCE"/>
    		<field name="authDate" applyType="TARGET" valueType="FIELD" value="pctDate"/>
    		<field name="pctDate" applyType="SOURCE"/>
    		<field name="country" applyType="TARGET" valueType="FIELD" value="requestCountry"/>
    		<field name="requestCountry" applyType="SOURCE"/>
    		<field name="applyer" applyType="TARGET" valueType="FIELD" value="firstRequest"/>
    		<field name="firstRequest" applyType="SOURCE"/>
    		<field name="money" applyType="TARGET" valueType="FIELD" value="transfermoney"/>
    		<field name="transfermoney" applyType="SOURCE"/>
    		<field name="statusType" applyType="TARGET" valueType="FIXED" value="1"/>
    		<field name="type" applyType="TARGET" valueType="FIXED" value="0"/>
    	</fields>
    	<where>
    		<condition type="EQUAL" applyType="SOURCE">
    			<field name="costtype" applyType="SOURCE" valueType="FIXED" value="SQ5"></field>
    		</condition>
    	</where>
    	<formats>
    		<format clazz="com.ipph.migratecore.deal.format.PctNoFormater" fieldName="patentNo"/>
    		<format clazz="com.ipph.migratecore.deal.format.JsonMethodFormater" fieldName="requestCountry">{'QT':'CN','MG':'US','ZG':'CN','RB':'JP','OM':'EP'}</format>
    	</formats>
    	<constraints>
    		<constraint type="PRIMARY" applyType="SOURCE">
    			<field name="id" applyType="SOURCE"/>
    		</constraint>
    		<constraint type="PRIMARY" applyType="TARGET">
    			<field name="id" applyType="TARGET"/>
    		</constraint>
    	</constraints>
    </table>
</tables>