<?xml version="1.0" encoding="UTF-8"?>
<tables xmlns="http://www.migrate.org/schema/tableschema"  xmlns:xsi="http://www.w3.org/2001/XMLSchema-instance" 
	 xsi:schemaLocation="http://www.migrate.org/schema/tableschema tables.xsd" >
    <!-- 专利申请数据的更新 -->
   <table type="MIGRATE" to="cs_rights_copyright_owner" from="copyright_upload_model" note="软件著作权补助数据迁移-影视-著作权人-补充" skip="false" main="cs_rights_copyright">
    	<fields>
    		<!-- target field list -->
    		<field name="id" applyType="TARGET" valueType="GENCODE"></field>
    		<field name="rid" applyType="TARGET" valueType="FIELD" value="id"/>
    		<field name="obligeeName" applyType="TARGET" valueType="FIELD" value="owner_name"/>
    		<!-- source field list -->
    		<field name="id" applyType="SOURCE"/>
    		<field name="owner_name" applyType="SOURCE" forLog="true"/>
    	</fields>
    	<where>
    		<condition type="ISNOTNULL" applyType="SOURCE">
    			<field name="owner_name" applyType="SOURCE"></field>
    		</condition>
    		<condition type="IN" applyType="SOURCE">
    			<field name="type" applyType="SOURCE" valueType="FIXED" value="类似摄制电影方法创作,类似摄制电影方法,录像,电影,录音,类似摄制电影方法创作的作品,录音制品,录像制品"></field>
    		</condition>
    	</where>
    	<constraints>
    		<constraint type="PRIMARY" applyType="SOURCE">
    			<field name="id" applyType="SOURCE"/>
    		</constraint>
    		<constraint type="PRIMARY" applyType="TARGET" value="cs_rights_copyright">
    			<field name="rid" applyType="TARGET"/>
    		</constraint>
    		<!-- 子表外键 -->
    		<constraint type="FOREIGNKEY" applyType="TARGET">
    			<field name="rid" applyType="TARGET"/>
    		</constraint>
    	</constraints>
    	<splits>
    		<split clazz="com.ipph.migratecore.deal.split.CharacterSpliter" fieldName="owner_name">[,;\/ :]</split>
    	</splits>
    </table>
</tables>