<?xml version="1.0" encoding="UTF-8"?>
<tables xmlns="http://www.migrate.org/schema/tableschema"  xmlns:xsi="http://www.w3.org/2001/XMLSchema-instance" 
	 xsi:schemaLocation="http://www.migrate.org/schema/tableschema tables.xsd" >
    <!-- 专利申请数据的更新 -->
   <table type="MIGRATE" to="cs_copyright" from="copyright_upload_model" note="软件著作权补助数据迁移-文字-补充" skip="false">
    	<fields>
    		<!-- target field list -->
    		<field name="id" applyType="TARGET" valueType="FIELD" value="id"></field>
    		<field name="batchNo" applyType="TARGET" valueType="FIELD" value="work_no" note="登记号"></field>
    		<field name="copyrightName" applyType="TARGET" valueType="FIELD" value="work_name"/>
    		<field name="copyrightType" applyType="TARGET" valueType="FIELD" value="type"/>
    		<field name="applicantName" applyType="TARGET" valueType="FIELD" value="applicant_name"/>
    		<field name="RightOwnership" applyType="TARGET" valueType="FIELD" value="right_ownership"/>
    		<field name="RightOwnershipStatus" applyType="TARGET" valueType="FIELD" value="right_ownership_status"/>
    		<field name="applyContacts" applyType="TARGET" valueType="FIELD" value="apply_contacts"/>
    		<field name="applyType" applyType="TARGET" valueType="FIELD" value="apply_type"/>
   			<field name="authorName" applyType="TARGET" valueType="FIELD" value="author_name"/>
   			<field name="finishDate" applyType="TARGET" valueType="FIELD" value="finish_date"/>
   			<field name="firstPublicCity" applyType="TARGET" valueType="FIELD" value="first_public_city"/>
   			<field name="firstPublicDate" applyType="TARGET" valueType="FIELD" value="first_public_date"/>
   			<field name="getRightWay" applyType="TARGET" valueType="FIELD" value="get_right_way"/>
    		<field name="awardDate" applyType="TARGET" valueType="FIELD" value="create_date"/>
    		<field name="registFee" applyType="TARGET" valueType="FIELD" value="regist_fee"/>
    		
    		<field name="supportStatus" applyType="TARGET" valueType="FIXED" value="0"/>
    		<field name="result" applyType="TARGET" valueType="FIXED" value="1"/>
    		<field name="status" applyType="TARGET" valueType="FIXED" value="1"/>
    		<field name="odata" applyType="TARGET" valueType="FIXED" value="1"/>
    		
    		<!-- source field list -->
    		<field name="id" applyType="SOURCE"/>
    		<field name="work_no" applyType="SOURCE"/>
    		<field name="work_name" applyType="SOURCE" forLog="true" note="著作权名称"/>
    		<field name="type" applyType="SOURCE"/>
    		<field name="applicant_name" applyType="SOURCE"/>
    		<field name="right_ownership" applyType="SOURCE"/>
    		<field name="right_ownership_status" applyType="SOURCE"/>
    		<field name="apply_contacts" applyType="SOURCE"/>
    		<field name="apply_type" applyType="SOURCE"/>
    		<field name="author_name" applyType="SOURCE"/>
    		<field name="finish_date" applyType="SOURCE"/>
    		<field name="first_public_city" applyType="SOURCE"/>
    		<field name="first_public_date" applyType="SOURCE"/>
    		<field name="get_right_way" applyType="SOURCE"/>
    		<field name="create_date" applyType="SOURCE"/>
    		<field name="regist_fee" applyType="SOURCE"/>
    	</fields>
    	<where>
    		<condition type="IN" applyType="SOURCE">
    			<field name="type" applyType="SOURCE" valueType="FIXED" value="其他,工程设计、产品设计,工程设计图 产品设计图,工程设计图、产品设计图,戏剧,文字,模型,美术,音乐,摄影"></field>
    		</condition>
    	</where>
    	<formats>
    		<format clazz="com.ipph.migratecore.deal.format.JsonMethodFormater" fieldName="type">{'工程设计、产品设计':'图形','工程设计图 产品设计图':'图形','工程设计图、产品设计图':'图形','其他':'其他','戏剧':'戏剧','文字':'文字','模型':'模型','美术':'美术','音乐':'音乐','摄影':'摄影'}</format>
    		<format clazz="com.ipph.migratecore.deal.format.JsonMethodFormater" fieldName="apply_type">{'由著作人申请':'由著作权人申请','由著作权人申请':'由著作权人申请','由代理人申请':'由代理人申请'}</format>
    		<format clazz="com.ipph.migratecore.deal.format.JsonMethodFormater" fieldName="get_right_way" defaultValue="其他">{'原始':'原始','继承':'继承','承受':'承受','其他':'其他'}</format>
    	</formats>
    	<constraints>
    		<constraint type="PRIMARY" applyType="SOURCE">
    			<field name="id" applyType="SOURCE"/>
    		</constraint>
    		<constraint type="PRIMARY" applyType="TARGET">
    			<field name="id" applyType="TARGET"/>
    		</constraint>
    	</constraints>
    </table>
</tables>