<?xml version="1.0" encoding="UTF-8"?>
<tables xmlns="http://www.migrate.org/schema/tableschema"  xmlns:xsi="http://www.w3.org/2001/XMLSchema-instance" 
	 xsi:schemaLocation="http://www.migrate.org/schema/tableschema tables.xsd" >
    <!-- 专利申请数据的更新 -->
   <table type="MIGRATE" to="cs_rights_copyright" from="tcopyrightallo" note="软件著作权补助数据迁移-影视" skip="false">
    	<fields>
    		<!-- target field list -->
    		<field name="rid" applyType="TARGET" valueType="FIELD" value="id"></field>
    		<field name="registNo" applyType="TARGET" valueType="FIELD" value="workno" note="登记号"></field>
    		<field name="copyrightName" applyType="TARGET" valueType="FIELD" value="workname"/>
    		<field name="copyrightType" applyType="TARGET" valueType="FIELD" value="workType"/>
    		<field name="issueDate" applyType="TARGET" valueType="FIELD" value="releasedate"/>
    		<field name="registFee" applyType="TARGET" valueType="FIELD" value="regcost"/>
    		<field name="applyName" applyType="TARGET" valueType="FIELD" value="name"/>
    		<field name="applyAddress" applyType="TARGET" valueType="FIELD" value="address"/>
    		<field name="applyPostalcode" applyType="TARGET" valueType="FIELD" value="zip"/>
    		<field name="applyContacts" applyType="TARGET" valueType="FIELD" value="linkman"/>
    		<field name="applyPhone" applyType="TARGET" valueType="FIELD" value="linkphone"/>
    		<field name="applyEmail" applyType="TARGET" valueType="FIELD" value="email"/>
    		<field name="applyTel" applyType="TARGET" valueType="FIELD" value="mobile"/>
    		<field name="applyFax" applyType="TARGET" valueType="FIELD" value="fax"/>
    		<field name="createDate" applyType="TARGET" valueType="FIELD" value="createTime"/>
    		<field name="county" applyType="TARGET" valueType="FIELD" value="area"/>
    		<field name="supportStatus" applyType="TARGET" valueType="FIXED" value="1"/>
    		<field name="result" applyType="TARGET" valueType="FIXED" value="1"/>
    		<field name="status" applyType="TARGET" valueType="FIXED" value="1"/>
    		<field name="odata" applyType="TARGET" valueType="FIXED" value="1"/>
    		
    		<!-- source field list -->
    		<field name="id" applyType="SOURCE"/>
    		<field name="workno" applyType="SOURCE"/>
    		<field name="workname" applyType="SOURCE" forLog="true" note="著作权名称"/>
    		<field name="workType" applyType="SOURCE"/>
    		<field name="sourceType" applyType="SOURCE"/>
    		<field name="worker" applyType="SOURCE"/>
    		<field name="copyrightman" applyType="SOURCE"/>
    		<field name="releasedate" applyType="SOURCE"/>
    		<field name="regcost" applyType="SOURCE"/>
    		<field name="name" applyType="SOURCE"/>
    		<field name="address" applyType="SOURCE"/>
    		<field name="zip" applyType="SOURCE"/>
    		<field name="linkman" applyType="SOURCE"/>
    		<field name="linkphone" applyType="SOURCE"/>
    		<field name="email" applyType="SOURCE"/>
    		<field name="mobile" applyType="SOURCE"/>
    		<field name="fax" applyType="SOURCE"/>
    		<field name="createTime" applyType="SOURCE"/>
    		<field name="area" applyType="SOURCE"/>
    	</fields>
    	<where>
    		<condition type="IN" applyType="SOURCE">
    			<field name="workType" applyType="SOURCE" valueType="FIXED" value="LYZP,LXZP,SY,SZDY,DY"></field>
    		</condition>
    	</where>
    	<formats>
    		<format clazz="com.ipph.migratecore.deal.format.JsonMethodFormater" fieldName="workType" defaultValue="录像制品">{'LXZP':'录像制品','LYZP':'录音制品','SY':'录像制品','SZDY':'录像制品','DY':'录像制品'}</format>
    		<format clazz="com.ipph.migratecore.deal.format.JsonMethodFormater" fieldName="area">{'YLQ':'岳麓区','GXQ':'高新区','HRQ':'芙蓉区','YHQ':'雨花区','JKQ':'经开区','KFQ':'开福区','TXQ':'天心区','CSX':'长沙县','LXX':'宁乡县','LYX':'浏阳市','WCQ':'望城区'}</format>
    	</formats>
    	<constraints>
    		<constraint type="PRIMARY" applyType="SOURCE">
    			<field name="id" applyType="SOURCE"/>
    		</constraint>
    		<constraint type="PRIMARY" applyType="TARGET">
    			<field name="rid" applyType="TARGET"/>
    		</constraint>
    	</constraints>
    </table>
</tables>