<?xml version="1.0" encoding="UTF-8"?>
<tables xmlns="http://www.migrate.org/schema/tableschema"  xmlns:xsi="http://www.w3.org/2001/XMLSchema-instance" 
	 xsi:schemaLocation="http://www.migrate.org/schema/tableschema tables.xsd" >
    <!-- 专利申请数据的更新 -->
   <table type="MIGRATE" to="wf_patent_support_foreign" from="patent_upload_model" note="专利PCT补录授权数据迁移" skip="false">
    	<fields>
    		<field name="id" applyType="TARGET" valueType="FIELD" value="id" note="主键字段"></field>
    		<field name="id" applyType="SOURCE"/>
    		<field name="patentName" applyType="TARGET" valueType="FIELD" value="patent_name"/>
    		<field name="patent_name" applyType="SOURCE"/>
    		<field name="applyNo" applyType="TARGET" valueType="FIELD" value="patent_no"/>
    		<field name="patent_no" applyType="SOURCE" note="申请号" forLog="true"></field>
    		<field name="applyDate" applyType="TARGET" valueType="FIELD" value="request_date"/>
    		<field name="request_date" applyType="SOURCE"/>
    		<field name="authDate" applyType="TARGET" valueType="FIELD" value="auth_date"/>
    		<field name="auth_date" applyType="SOURCE"/>
    		<field name="country" applyType="TARGET" valueType="FIELD" value="request_country"/>
    		<field name="request_country" applyType="SOURCE"/>
    		<field name="applyer" applyType="TARGET" valueType="FIELD" value="first_request"/>
    		<field name="first_request" applyType="SOURCE"/>
    		<field name="money" applyType="TARGET" valueType="FIELD" value="transfer_money"/>
    		<field name="transfer_money" applyType="SOURCE"/>
    		<field name="statusType" applyType="TARGET" valueType="FIXED" value="1"/>
    		<field name="type" applyType="TARGET" valueType="FIXED" value="1"/>
    	</fields>
    	<where>
    		<condition type="EQUAL" applyType="SOURCE">
    			<field name="cost_type" applyType="SOURCE" valueType="FIXED" value="SQ6"></field>
    		</condition>
    	</where>
    	<formats>
    		<format clazz="com.ipph.migratecore.deal.format.PctNoFormater" fieldName="patent_no"/>
    		<format clazz="com.ipph.migratecore.deal.format.JsonMethodFormater" fieldName="request_country">{'QT':'CN','MG':'US','ZG':'CN','RB':'JP','OM':'EP'}</format>
    	</formats>
    	<constraints>
    		<constraint type="PRIMARY" applyType="SOURCE">
    			<field name="id" applyType="SOURCE"/>
    		</constraint>
    		<constraint type="PRIMARY" applyType="TARGET">
    			<field name="id" applyType="TARGET"/>
    		</constraint>
    	</constraints>
    </table>
</tables>