<?xml version="1.0" encoding="UTF-8"?>
<tables xmlns="http://www.migrate.org/schema/tableschema"  xmlns:xsi="http://www.w3.org/2001/XMLSchema-instance" 
	 xsi:schemaLocation="http://www.migrate.org/schema/tableschema tables.xsd" >
    <!-- 专利申请数据的更新 -->
   <table type="MIGRATE" to="cs_copyright_dest" from="tcopyrightallo" note="软件著作权补助数据迁移" skip="false">
    	<fields>
    		<!-- target field list -->
    		<field name="id" applyType="TARGET" valueType="FIELD" value="id"></field>
    		<field name="batchNo" applyType="TARGET" valueType="FIELD" value="workno" note="登记号"></field>
    		<field name="copyrightName" applyType="TARGET" valueType="FIELD" value="workname"/>
    		<field name="copyrightType" applyType="TARGET" valueType="FIELD" value="workType"/>
    		<field name="userType" applyType="TARGET" valueType="FIELD" value="sourceType"/>
    		<field name="authorName" applyType="TARGET" valueType="FIELD" value="worker"/>
    		<field name="ownerName" applyType="TARGET" valueType="FIELD" value="copyrightman"/>
    		<field name="awardDate" applyType="TARGET" valueType="FIELD" value="releasedate"/>
    		<field name="registFee" applyType="TARGET" valueType="FIELD" value="regcost"/>
    		<field name="applicantName" applyType="TARGET" valueType="FIELD" value="name"/>
    		<field name="applicantAddress" applyType="TARGET" valueType="FIELD" value="address"/>
    		<field name="applicantPostcode" applyType="TARGET" valueType="FIELD" value="zip"/>
    		<field name="applyContacts" applyType="TARGET" valueType="FIELD" value="linkman"/>
    		<field name="applicantTel" applyType="TARGET" valueType="FIELD" value="linkphone"/>
    		<field name="applicantEmail" applyType="TARGET" valueType="FIELD" value="email"/>
    		<field name="applyContactsPhone" applyType="TARGET" valueType="FIELD" value="mobile"/>
    		<field name="applicantFax" applyType="TARGET" valueType="FIELD" value="fax"/>
    		<field name="createDate" applyType="TARGET" valueType="FIELD" value="createTime"/>
    		<field name="county" applyType="TARGET" valueType="FIELD" value="area"/>
    		<field name="supportStatus" applyType="TARGET" valueType="FIXED" value="1"/>
    		<field name="result" applyType="TARGET" valueType="FIXED" value="1"/>
    		<field name="status" applyType="TARGET" valueType="FIXED" value="1"/>
    		<field name="odata" applyType="TARGET" valueType="FIXED" value="1"/>
    		<!-- source field list -->
    		<field name="id" applyType="SOURCE"/>
    		<field name="workno" applyType="SOURCE"/>
    		<field name="workname" applyType="SOURCE" forLog="true" note="著作权名称"/>
    		<field name="workType" applyType="SOURCE"/>
    		<field name="sourceType" applyType="SOURCE"/>
    		<field name="worker" applyType="SOURCE"/>
    		<field name="copyrightman" applyType="SOURCE"/>
    		<field name="releasedate" applyType="SOURCE"/>
    		<field name="regcost" applyType="SOURCE"/>
    		<field name="name" applyType="SOURCE"/>
    		<field name="address" applyType="SOURCE"/>
    		<field name="zip" applyType="SOURCE"/>
    		<field name="linkman" applyType="SOURCE"/>
    		<field name="linkphone" applyType="SOURCE"/>
    		<field name="email" applyType="SOURCE"/>
    		<field name="mobile" applyType="SOURCE"/>
    		<field name="fax" applyType="SOURCE"/>
    		<field name="createTime" applyType="SOURCE"/>
    		<field name="area" applyType="SOURCE"/>
    	</fields>
    	<where>
    		<condition type="NOTIN" applyType="SOURCE">
    			<field name="workType" applyType="SOURCE" valueType="FIXED" value="LYZP,LXZP,SY,SZDY,DY"></field>
    		</condition>
    		<condition type="LE" applyType="SOURCE">
    			<field name="id" applyType="SOURCE" valueType="FIXED" value="1000"/>
    		</condition>
    	</where>
    	<formats>
    		<format clazz="com.ipph.migratecore.deal.format.JsonMethodFormater" fieldName="workType">{'WZ':'文字','KS':'口述','YY':'音乐','XJ':'戏剧','QY':'曲艺','WD':'舞蹈','ZJ':'杂技艺术','MS':'美术','JZ':'建筑','SJT':'图形','MX':'模型','QT':'其他','RJ':'其他','DT':'图形'}</format>
    		<format clazz="com.ipph.migratecore.deal.format.JsonMethodFormater" fieldName="sourceType">{'QY':'企业','KYYS':'其他','GR':'个人','ZCGX':'高校','SHTT':'其他','JG':'其他'}</format>
    		<format clazz="com.ipph.migratecore.deal.format.JsonMethodFormater" fieldName="area">{'YLQ':'岳麓区','GXQ':'高新区','HRQ':'芙蓉区','YHQ':'雨花区','JKQ':'经开区','KFQ':'开福区','TXQ':'天心区','CSX':'长沙县','LXX':'宁乡县','LYX':'浏阳市','WCQ':'望城区'}</format>
    	</formats>
    	<constraints>
    		<constraint type="PRIMARY" applyType="SOURCE">
    			<field name="id" applyType="SOURCE"/>
    		</constraint>
    		<constraint type="PRIMARY" applyType="TARGET">
    			<field name="id" applyType="TARGET"/>
    		</constraint>
    	</constraints>
    </table>
</tables>